{"schema_version":1,"run_id":"be02-95f0c87268f4473f8fed1d20f71a74f2-0","dispatch_id":"completion1020-focused","lane":"playwright_real","transport_profile":"internal_http","scenario_path_id":"SCN-QA-827-F1","partition":"held-and-rejected-attachments-never-yield-bytes","framework_test_id":"SCN-QA-827-F1","test_file":"tests/acceptance/playwright/cases.ts","implementation_mode":"real","attempt":0,"attempt_id":"SCN-QA-827-F1.playwright_real.0","retry_of":null,"started_at":"2026-10-19T19:45:46.498Z","ended_at":"2026-10-19T19:45:47.139Z","duration_ms":641,"status":"passed","reason":null,"authority_variant":"real-cookie-session-supported-auth-admin-seed","assertions":["Real held and rejected content are 423 JSON errors; rejected metadata has zero bytes and no private key or URL"],"evidence":[],"artifacts":[]}
