{"schema_version":1,"run_id":"be02-4ea18154c15a47f69cbd3f3b7f1b521a-0","dispatch_id":"completion1020-focused","lane":"playwright_real","transport_profile":"internal_http","scenario_path_id":"SCN-QA-829-F1","partition":"real-attachment-loading-and-controlled-transport-loss","framework_test_id":"SCN-QA-829-F1","test_file":"tests/acceptance/playwright/cases.ts","implementation_mode":"real","attempt":0,"attempt_id":"SCN-QA-829-F1.playwright_real.0","retry_of":null,"started_at":"2026-10-19T19:43:01.606Z","ended_at":"2026-10-19T19:43:04.076Z","duration_ms":2470,"status":"passed","reason":null,"authority_variant":"real-cookie-session-supported-auth-admin-seed","assertions":["Controlled held real GET200 exposed loading; controlled no-forward loss exposed retryable error, then real V2 retry200 settled metadata"],"evidence":["Fault injection held actual upstream response and separately aborted an unforwarded request; no metadata or bytes were fabricated"],"artifacts":["native-private/QA816-ATT-F1-loading-390.png","native-private/QA816-ATT-F1-error-390.png"]}
