{"schema_version":1,"run_id":"be02-e9a0fa0ee9284caeb2729af5a715cd6f-0","dispatch_id":"completion1020-focused","lane":"playwright_real","transport_profile":"internal_http","scenario_path_id":"SCN-AUTH-006-P","partition":"genuine-invitation-scanner-victim-replay","framework_test_id":"SCN-AUTH-006-P","test_file":"tests/acceptance/playwright/cases.ts","implementation_mode":"real","attempt":0,"attempt_id":"SCN-AUTH-006-P.playwright_real.0","retry_of":null,"started_at":"2026-10-19T19:17:28.293Z","ended_at":"2026-10-19T19:17:29.395Z","duration_ms":1102,"status":"passed","reason":null,"authority_variant":"real-cookie-session-supported-auth-admin-seed","assertions":["Scanner GET did not consume invitation; genuine UI acceptance bound actor and organization and rendered mailbox","Consumed invitation rejected in isolated replay context with session 401 and no protected contents"],"evidence":["Observed POST /v1/auth/accept 200 and GET /v1/session 401 before acceptance, 200 afterward"],"artifacts":[]}
