{"schema_version":1,"run_id":"be02-6077cbef09ad410b8bd8d23f8af9b2a9-0","dispatch_id":"completion1020-focused","lane":"playwright_real","transport_profile":"internal_http","scenario_path_id":"SCN-QA-829-P","partition":"real-attachment-list-and-private-browser-download","framework_test_id":"SCN-QA-829-P","test_file":"tests/acceptance/playwright/cases.ts","implementation_mode":"real","attempt":0,"attempt_id":"SCN-QA-829-P.playwright_real.0","retry_of":null,"started_at":"2026-10-19T19:41:08.674Z","ended_at":"2026-10-19T19:41:10.634Z","duration_ms":1960,"status":"passed","reason":null,"authority_variant":"real-cookie-session-supported-auth-admin-seed","assertions":["Real V2 list200 displayed clean/held/rejected states; only clean download control emitted real V2 content200 and browser bytes matching private SHA-256/length"],"evidence":[],"artifacts":["native-private/QA816-ATT-P-list-390.png","native-private/QA816-ATT-P-downloaded-390.png"]}
