{"schema_version":1,"run_id":"be02-087ea53cf2bc4c7fb704c250ab550618-0","dispatch_id":"completion1020-focused","lane":"playwright_real","transport_profile":"internal_http","scenario_path_id":"SCN-QA-827-F2","partition":"foreign-mailbox-attachment-bytes-are-unavailable","framework_test_id":"SCN-QA-827-F2","test_file":"tests/acceptance/playwright/cases.ts","implementation_mode":"real","attempt":0,"attempt_id":"SCN-QA-827-F2.playwright_real.0","retry_of":null,"started_at":"2026-10-19T19:47:12.064Z","ended_at":"2026-10-19T19:47:12.574Z","duration_ms":510,"status":"passed","reason":null,"authority_variant":"real-cookie-session-supported-auth-admin-seed","assertions":["Real cross-mailbox content request returns uniform 404 without private bytes"],"evidence":[],"artifacts":[]}
