{"schema_version":1,"run_id":"be02-eba328cebab6494a9204145e35a60fac-0","dispatch_id":"completion1020-focused","lane":"playwright_real","transport_profile":"internal_http","scenario_path_id":"SCN-QA-827-P","partition":"clean-private-attachment-bytes-match-disposable-seed","framework_test_id":"SCN-QA-827-P","test_file":"tests/acceptance/playwright/cases.ts","implementation_mode":"real","attempt":0,"attempt_id":"SCN-QA-827-P.playwright_real.0","retry_of":null,"started_at":"2026-10-19T19:44:23.843Z","ended_at":"2026-10-19T19:44:24.517Z","duration_ms":674,"status":"passed","reason":null,"authority_variant":"real-cookie-session-supported-auth-admin-seed","assertions":["Real private V2 list/content 200 returned clean bytes matching disposable fixture SHA-256 and safe response headers"],"evidence":[],"artifacts":[]}
